;_id;masked;Kompetenz;Inkompetenz;Wärme;Kälte;Benefit Wirtschaft;Threat Wirtschaft;Benefit Sicherheit;Threat Sicherheit;Benefit Kultur;Threat Kultur
0;6327128c3dd49b919c1102f8;Haju Abdi Dhiblawe, ein Geschäftsmann, der Weizenmehl importiert, befürchtet, dass es sogar noch schlimmer wird. Denn es droht ein Mangel an Schiffscontainern, um Nahrungsmittel von anderswo her nach [Gruppe1] zu transportieren. „Die [Gruppe1] haben keinen Ort, um Weizen anzubauen, und wir wissen nicht einmal, wie man ihn anbaut“, sagt er. „Unsere Hauptsorge ist, was uns die Zukunft bringen wird, wenn uns die Lieferungen ausgehen.“;0;0;0;0;0;0;0;0;0;0
1;6327129a3dd49b919c16af2e;Mehr als zwei Jahre nach dem qualvollen Tod von 39 vietnamesischen [Gruppe1] in einem Kühllastwagen in Großbritannien hat ein belgisches Gericht einen Schleuser zu 15 Jahren Haft verurteilt. Der 45-jährige Vietnamese habe eine führende Rolle in dem Fall gespielt, urteilte das Gericht in Brügge. Gegen den Mann wurde zudem eine Geldstrafe in Höhe von knapp einer Million Euro verhängt.;0;0;0;0;0;0;0;0;0;0
2;638a5a8385bdc1cf6d07393d;ASYL: Wegen der hohen Zuwanderungszahlen sind die Bundesländer und die Kommunen in Deutschland laut Bayerns Innenminister Joachim Herrmann (CSU) „am Limit“. Finanzielle Hilfe reiche daher nicht aus. Der Bund müsse sich auch um eine Begrenzung der irregulären Migration und eine konsequente Rückführung abgelehnter Asylbewerber kümmern. Und angesichts der angespannten Lage müsse der Bund auch bereits avisierte Aufnahmeprogramme nochmals kritisch hinterfragen. Bereits zugesagt hat die Bundesregierung die Aufnahme von aus Seenot geretteten [Gruppe4], die nach Italien gebracht wurden. Außerdem gibt es ein Programm für besonders schutzbedürftige [Gruppe1].;0;0;0;0;0;1;0;0;0;0
3;632712b13dd49b919c1f812f;Die Maschine hob mit nur sieben Personen an Bord in Kabul ab. Der für den Flug registrierte Rest gelangte im Chaos jener Tage nicht ans Gate. US-Flugzeuge brachten schließlich 189 [Gruppe1] in Sicherheit, die im von den deutschen Helfern gecharterten Airbus A 320 mitfliegen sollten. Wenige Tage später überließen die Amerikaner den Flughafen den Taliban.;0;0;0;0;0;0;0;0;0;0
4;63a939750e0cf85f080b9e53;Tatsächlich zieren Fotos mit FIFA-Chef Infantino, einigen argentinischen Nationalspielern sowie dem katarischen Emir Tamim bin Hamad Al Thani das Instagram-Profil des [Gruppe1]. Ein Foto mit dem Objekt seiner Begierde gelang Salt Bae schließlich, als er den argentinischen Mittelfeldspieler Ángel Di María traf. Zu sehen ist, wie Gökçe gemeinsam mit Di María und dem WM-Pokal posiert und dabei ein beherztes „Miau“ von sich gibt – was dem sichtlich verwirrten Argentinier zumindest eine „Daumen hoch“-Geste entlockt.;1;0;0;0;0;0;0;0;0;0
5;632712913dd49b919c1347a1;Panorama 10.02.2023 02:17 min Komplizierte Hilfe nach Erdbeben [Gruppe1] erleben Katastrophe nach der Katastrophe Politik 10.02.2023 01:50 min;0;0;0;0;0;0;0;0;0;0
6;632712773dd49b919c0800a6;Sie verwies darauf, dass Deutschland direkt nach Beginn des Krieges Soforthilfe von 185 Millionen Euro bereitgestellt habe. Diese Unterstützung solle nun mit bereits zugesagten 406 Millionen Euro fortgesetzt werden. „Der Schwerpunkt soll auf der Unterstützung innerhalb des Landes [Gruppe1] Familien liegen, sagte Schulze.;0;0;0;0;0;1;0;0;0;0
7;632712943dd49b919c1468cc;Der junge Mann war mit Anfang zwanzig eingezogen worden und musste im Ersten Weltkrieg gegen die [Gruppe1] kämpfen. Auf der Karte, die er an seinen Schwager Roy Coombridge schickte, der damals gerade mal 14 Jahre alt war und auf einer Farm in Neuseeland lebte, schrieb er, dass er „in ein paar Tagen wieder zu den [Gruppe1] zurückkehren“ werde. Und: „Es kann lange dauern, bis ich wieder schreiben kann.“;0;0;0;0;0;0;0;0;0;0
8;632712803dd49b919c0ba2a4;Die Ermittler waren zunächst davon ausgegangen, dass der damals 27 Jahre alte [Gruppe1] bei der Tat in dem Zug psychisch krank war. Im Zuge der Ermittlungen wurde jedoch klar, dass er der radikal-islamistischen Szene zuzuordnen ist und aus Hass gegen das freiheitliche System des Westens gehandelt hatte. In seinem Umfeld waren Verbindungen zum Terrornetzwerk Islamischer Staat (IS) gefunden worden.;0;0;0;0;0;0;0;1;0;0
9;63763fa64493acc04303c82b;"
Mehr zum Thema Dresden Crime: Drei Jugendliche in Gorbitz brutal ausgeraubt: Kripo ermittelt
Katalysatoren-Klau in Dresden: Opel sind derzeit besonders beliebt
[Gruppe1] beim Eislaufen ausländerfeindlich beschimpft: Polizei sucht Zeugen";0;0;0;0;0;0;0;0;0;0
10;633c132aec99a22262090b29;Die [Gruppe1] sagte zu dem Uniformierten: „Das ist mein Haus, geh raus!“ Der antwortete unter anderem in diesen Worten: „Das ist mein Land und du bist hier Gast!“ Die Frau, die es als Mutter zuließ, dass Kinder, darunter ein Kleinkind, Zeugen der Auseinandersetzungen wurden, wirkte dabei immer wieder mit Händen und mit Schreien auf den Polizisten ein, der daraufhin erwiderte: „Du bist hier in meinem Land, du hast dich nach unseren Gesetzen zu verhalten! Schrei mich nicht an und fass mich nie wieder an, ich bringe dich ins Gefängnis.“ Der Pulverdampf der üblichen Empörungsvertreter hat sich langsam gelegt. Zeit für eine Betrachtung der Geschehnisse.;0;0;0;0;0;0;0;0;0;1
11;632712703dd49b919c05dd94;"
US-Senator Marco Rubio greift für seine Kritik an US-Präsident Joe Biden auf seine Familiengeschichte zurück. Als Sohn kubanischer [Gruppe1] komme ihm „die Razzia von Joe Bidens FBI“ im Anwesen von dessen Vorgänger Donald Trump allzu bekannt vor, hieß es in einer Werbemail Rubios. „Sobald diese radikalen Diktatoren die Macht übernommen haben, verfolgen sie erst ihre politischen Gegner. Als nächstes nehmen sie jeden ins Visier, der sich auf die Seite ihrer politischen Gegner stellt - bis sie jeden einsperren, der nicht mit ihnen übereinstimmt.“ Ein Klick auf den Button „Stoppt die Linke“ führt zur Spendenseite, die von einem Trump-Foto dominiert wird.";0;0;0;0;0;0;0;0;0;0
12;632712ab3dd49b919c1d93f7;Diese Maßnahme wird vom Bund mit „Sicherheitsinteressen“ begründet, das Land Berlin hat dabei kein Mitspracherecht. Welche Sicherheit hier bedroht sein soll, ist jedoch unklar. Schließlich geht es nicht um die Erlangung eines Aufenthaltstitels, sondern um den Bezug von Leistungen zur Grundsicherung. Dass dieser für [Gruppe1]*in­nen erschwert wird, erinnert nur allzu sehr an das rassistische Vorurteil des „Sozialtourismus“ aus Osteuropa, der von rechten Po­li­ti­ke­r*in­nen immer wieder bemüht wird, um ihre Ablehnung gegenüber Mi­gran­t*in­nen zu begründen.;0;0;0;0;0;1;0;0;0;0
13;632712c33dd49b919c26e4e1;Auch die Weltbank hilft: „Wir haben einige unserer Lang­zeit­projekte ausgeweitet und neu fokussiert, um [Gruppe1] Regierung bei der Dürre­bewältigung zu unterstützen“, sagt Landes­vertreterin Kristina Svensson. Geholfen werde unter anderem durch Wasserprojekte und Zuschüsse für 500.000 Haushalte. Jedoch herrscht Sorge, dass die Hilfe nicht ausreicht. Obwohl das UN‑Welt­ernährungs­programm (WFP) mit 3,7 Millionen so viele [Gruppe1] mit Notrationen versorgt wie nie zuvor, droht eine Hungersnot. Dazu meint Hashi: „Viele internationale Organisationen und Spender haben ihren Fokus auf die Krise in der [Gruppe5] verlegt.“;0;0;0;0;0;1;0;0;0;0
14;632712943dd49b919c146086;Insgesamt wurden seinen Angaben zufolge 400 Zivilisten getötet und mindestens 800 verletzt. Diese Daten seien jedoch „definitiv unvollständig“, sagte Resnikow. Die Zahlen unabhängig zu bestätigen, war zunächst nicht möglich. Zuletzt verifizierte das UN-Hochkommissariat für Menschenrechte 364 Tote [Gruppe1] im Zusammenhang russischer Angriffe, darunter 25 Kinder. Die tatsächlichen Zahlen lägen jedoch um einiges höher, vermutet die UN.;0;0;0;0;0;0;0;0;0;0
15;632712b03dd49b919c1f3fc8;Hermann bezog sich auf aktuelle Zahlen des Bundesamts für Migration und [Gruppe3] (BAMF), wonach immer weniger [Gruppe4] mit höherer Bildung in Deutschland um Asyl bitten. So habe beispielsweise über die Hälfte aller nach Deutschland kommenden [Gruppe2] und [Gruppe1] nur Bildung auf Grundschulniveau. Auch [Gruppe7] [Gruppe4] verfügten über einen immer niedrigeren Bildungsstand. „Von qualifizierter Zuwanderung kann hier auch keine Rede sein“, bekräftigte der Minister. „Ich warne die Bundesregierung davor, Anreize zu setzen, daß sich noch mehr unqualifizierte Menschen in der Hoffnung auf Arbeit auf den Weg nach Deutschland machen.“;1;0;0;0;0;1;0;0;0;0
16;636143bd5ce81f94910ab247;Dafür kommt Kritik von der CDU. Sozial-Sprecherin Sigrid Grönert (63): „Gegen jeden Rat hat der Senat mehr [Gruppe1] aufgenommen, als Bremen es nach Einwohnerzahl und Steueraufkommen müsste. Gleichzeitig wurde versäumt, die mögliche Umverteilung unbegleiteter Minderjähriger durchzusetzen. Die linke [Gruppe1]politik ist gescheitert!“;0;0;0;0;0;0;0;0;0;0
17;632712823dd49b919c0c9e8f;Litauen hatte die Anreize für rückkehrwillige [Gruppe1] zuletzt deutlich erhöht. Um sie zur Rückkehr in den Irak zu bewegen, wurde ihnen eine Einmalzahlung von 1000 Euro pro Person zugesagt. Dieses Angebot gilt noch bis zum 20. Januar. Bei Bedarf könnten weitere Charterflüge organisiert werden, sagte der stellvertretende Leiter des Grenzschutzes im litauischen Radio.;0;0;0;0;0;1;0;0;0;0
18;632712903dd49b919c12fbf8;Danach waren Asylentscheidungen zurückgestellt worden, weil das Bundesamt für Migration und [Gruppe3] (BAMF) auf eine neue Einschätzung der Lage in [Gruppe1] durch die Bundesregierung wartete. Seit dem 1. Dezember werden auf Basis neuer Leitsätze wieder Entscheidungen zu Anträgen von [Gruppe1] getroffen. Die Bundeswehr war Ende Juni 2021 nach einem 20-jährigen Einsatz aus [Gruppe1] abgezogen. In der Folge des Abzugs aller auswärtigen Streitkräfte gewannen die militant-islamistischen Taliban die Oberhand in dem Land, Mitte August auch in der Hauptstadt Kabul.;0;0;0;0;0;0;0;0;0;0
19;6327128b3dd49b919c10cf3e;Ein Polizist, der in der Nähe einen Verkehrsunfall aufgenommen habe, sei sofort herbei geeilt. „Er konnte den Angriff nur durch den Einsatz seiner Schusswaffe unterbinden und gab mehrere Schüsse ab“, heißt es in der Mitteilung der Ermittler. Dabei wurde der 32-jährige [Gruppe1] verletzt. Mit wie vielen Schüssen und wie schwer, war zunächst unklar. Er werde im Krankenhaus bewacht.;0;0;0;0;0;0;0;1;0;0
20;6327128b3dd49b919c10d4e1; Bei der Ermittlung von Kriegsverbrechen in der [Gruppe3] setzen deutsche Behörden auf Zeugenaussagen von [Gruppe1]. „Die [Gruppe1] sind für uns auch potenzielle Zeugen von Kriegsverbrechen: Ihre Aussagen können für die Strafverfolgung von immenser Bedeutung sein“, sagte der Chef des Bundeskriminalamts, Holger Münch, dem RedaktionsNetzwerk Deutschland (RND). ;0;0;0;0;0;0;0;0;0;0
21;632712ab3dd49b919c1d8376;Wie das konkret aussehen könnte, wird jetzt klarer: Die bezirklichen Sozialämter, wo die [Gruppe1] bereits Leistungen beantragen können, sollen eine freiwillige Berufe-Abfrage bei den An­trag­stel­le­r*in­nen durchführen. In Mitte sei das die angedachte Praxis, bestätigte Schulstadträtin Stefanie Remlinger (Grüne) der taz. Allerdings habe sie noch keine Rückmeldungen aus dem Sozialamt, ob es schon auswertbare Ergebnisse gebe – und ob es überhaupt Ressourcen dafür gibt, angesichts des Andrangs auf den Sozialämtern. „Es ist gerade alles sehr im Aufbau“, sagte Remlinger.;0;0;0;0;0;0;0;0;0;0
22;632ccdc1a0d250ea9b0cd1ce;"Mehr aus Politik
883 Vollstreckungen in 2022Zahl der Hinrichtungen weltweit erreicht neuen RekordDie Menschenrechtsorganisation Amnesty International hat einen neuen Höchststand an vollstreckten Todesstrafen beobachtet. Im Jahr 2022 sind weltweit mindestens 833 Menschen hingerichtet worden – 65 Prozent davon im Iran. Beobachter rechnen mit einer hohen Dunkelziffer.„Gerade keine leichte Zeit für uns“Berliner Heizungsstreit und Bremer „Brötchentaste“: die Grünen in der KriseZwar errangen die Grünen bei den Kommunalwahlen in Schleswig-Holstein bisweilen sehr gute Ergebnisse. In Bremen allerdings erlebten sie ein Desaster und müssen um den Verbleib in der Regierung bangen. Das passt zur Gesamtsituation der Partei, die nicht besonders rosig ist.Was passiert mit dem OligarchenvermögenScholz beim Europarat: Zahlt Russland für den Wiederaufbau der [Gruppe5]?Der Europarat tagt erstmals seit 18 Jahren wieder auf Chefebene, der Kanzler fliegt dafür nach Island. Die für den Wiederaufbau der [Gruppe5] nötige Gesamtsumme wird auf bis zu eine Billion US-Dollar geschätzt – je nach dem wie lange der Krieg dauert. Eine entscheidende Frage ist, ob eingefrorene Milliarden der russischen Zentralbank oder von Oligarchen dafür eingesetzt werden.Empfehlungen zur Gesundheit der BevölkerungÄrztepräsident Reinhardt fordert Einführung eines „Deutschen Gesundheitsrates“Am Dienstag beginnt der 127. Ärztetag in Essen. Ärztepräsident Klaus Reinhardt fordert die Politik auf, nach dem Vorbild des Ethikrates einen „Deutschen Gesundheitsrat“ einzurichten. Es gebe heute kaum ein Politikfeld, das nicht mit gesundheitlichen Belangen der Menschen verwoben sei, argumentiert er.Zwei Drittel für ErdoganKurdische Gemeinde kritisiert Wahlverhalten der [Gruppe1] in Deutschland„Das ist auch ein Problem für Deutschland“: Der Vorsitzende der Kurdischen Gemeinde in Deutschland. Eli Ertan Toprak, hat das Wahlverhalten der in Deutschland wahlberechtigten [Gruppe1] kritisiert. „Die Menschen, die hier die Demokratie genießen, unterstützen eine Autokratie in der [Gruppe1]“, sagte Toprak dem RND.";0;0;0;0;0;0;0;0;0;1
23;632712953dd49b919c14aca9;2015 war der [Gruppe1] erstmals in Deutschland registriert worden. Seither fiel er zwar mehrmals wegen psychischer Probleme auf. Bis zum Tattag hatten die Behörden aber nach eigenen Angaben keine Hinweise darauf, dass der Mann andere Menschen gefährden könnte.;0;0;0;0;0;0;0;1;0;0
24;6327128c3dd49b919c1120ca;2020 – In der ostrussischen Region Chabarowsk beginnen wochenlange Massenproteste gegen die Verhaftung des Gouverneurs Sergej Furgal. Er wird beschuldigt, vor rund 16 Jahren an Morden beteiligt gewesen zu sein. Furgal hatte bei seiner Wahl 2018 den Kandidaten der Kremlpartei besiegt. 2012 – Mehr als acht Jahre nach Beginn des Einsatzes in Kundus Ende 2003 übergibt die Bundeswehr die Verantwortung für die Sicherheit in der Unruheregion an die [Gruppe1]. Sie sollen bis Ende 2014 im ganzen Land die Verantwortung von den internationalen Truppen übernehmen. 2007 – Das Europaparlament stimmt mit großer Mehrheit für die endgültige Abschaffung des Briefmonopols. Von 2011 an dürfen private Postdienste in der EU auch Briefe unter 50 Gramm überbringen. In Deutschland soll das Briefmonopol 2008 fallen.;0;0;0;0;0;0;0;0;0;0
25;632712c33dd49b919c26e4bd; Mehr als eine Million [Gruppe1] sind als Binnen[Gruppe3] unterwegs, da sie in ihren Dörfern und Städten keine Nahrung finden. „Eine Hungersnot steht vor der Tür“, warnte letzte Woche der Unter­general­sekretär der Vereinten Nationen für Humanitäre Einsätze, Martin Griffiths. Auch für den Koordinator der südafrikanischen Hilfsorganisation Gift of the Givers in Mogadischu, Abdirisack M. Hashi gehört der Anblick von ausgemergeltem Vieh und Kinderskeletten inzwischen zum Alltag. „Die Auswirkungen der Dürre sind in jedem Winkel [Gruppe1] sichtbar, man kann dem Hunger nicht mehr entkommen“, so der Helfer. Er spricht von einer „menschlichen Tragödie“, die selbst die Dürre von 2011 übertreffen könnte. Damals starben 250.000 Menschen.;0;0;0;0;0;0;0;0;0;0
26;632712723dd49b919c065cb8;"Unverständnis über ausstehende Aufnahme von [Gruppe1] Ortskräften „Deutschland hat Millionen [Gruppe5] geholfen, aber schafft keine 20.000 [Gruppe1]?“, fragte ein Teilnehmer des Treffens ehemaliger [Gruppe1] Ortskräfte. 
Der undotierte Preis erinnert an den Mitbegründer und langjährigen Vorsitzenden des [Gruppe3]rates, Matthias Lange, der 2006 starb. Die Auszeichnung wird in diesem Jahr zum vierten Mal vergeben.";0;0;0;0;0;0;0;0;0;0
27;632712c33dd49b919c26a6d1;Die ist mit der Anwesenheit der Polizisten in ihrer Wohnung nicht einverstanden, wird gegen einen der Beamten handgreiflich und fordert ihn zum Verlassen der Wohnung auf mit dem Hinweis: „Das ist mein Haus!“. Der kontert: „Das ist mein Land und du bist hier Gast!“. Das alleine handelt dem Beamten bereits Rassismus-Vorwürfe ein. Aber er ging sogar noch weiter, mit der Folge, dass gegen ihn nun ein Ermittlungsverfahren wegen des Anfangsverdachts einer fremdenfeindlichen Beleidigung anhängig ist und er in den Innendienst versetzt wurde, nachdem er sich mahnend an den festgenommenen [Gruppe1] gewandt hatte mit den Worten: „Deine Frau hat nicht so mit mir zu sprechen. Du bist hier in unserem Land, ihr habt euch nach unseren Gesetzen zu verhalten.“;0;0;0;0;0;0;0;1;0;1
28;6364e3df9f0b99c28b0bf0be;In Reaktion auf ein Blutbad, das ein [Gruppe1] in Ludwigshafen-Oggersheim angerichtet hat, twitterte der freie Journalist Jan A. Karon – in fußläufiger Entfernung aufgewachsen ­­– erbost über das „Shithole-Country mit Steinzeit-Kultur“, aus dem der Täter stammt, und „einen track record von Gewaltdelikten von [Gruppe1]“ in diesem unseren Lande. „Und wenn Berufsempörte mir jetzt sagen wollen, ich sei rechts, rassistisch oder fremdenfeindlich, weil ich keine Lust habe, das auszuschweigen, ist mir das egal“, ergänzte er in weiser Vorahnung. „Inzwischen passieren diese Einzelfälle jeden Tag, quer durchs Bundesgebiet.“;0;0;0;0;0;0;0;1;0;1
29;6327128b3dd49b919c107b27;Asiye Atalay hatte keine Chance. Die 19jährige ging am Abend des 5. Mai mit einer Freundin in Istanbul spazieren. Als ihr Ex-Freund, Ümit K., auftauchte, bemerkten Passanten, dass etwas nicht stimmte. Ein Nachbar filmte von einem Balkon aus, wie der 25jährige auf die schreiende junge Frau zugeht, die Hand hebt und sie mit einem Kopfschuss tötet. Ümit K. wurde festgenommen. Die Mutter Atalays gab zu Protokoll, dass der Täter bereits zwei Jahre im Gefängnis gesessen hatte, weil er seine Ex-Freundin heftig bedroht hatte. Sie war mittlerweile mit einem anderen Partner verlobt und wollte bald heiraten. Die Verteidigung von Ümit K. plädiert auf verminderte Zurechnungsfähigkeit und hat gute Chancen, damit durchzukommen. Die damalige Anzeige wegen Belästigung kann als Argument dafür dienen, dass er chronisch eifersüchtig sei – was paradoxerweise als entlastend gilt. »In der Gerichtspraxis er­leben wir immer wieder, dass Eifersucht und Jähzorn von Tätern mit Strafminderung belohnt werden«, sagt die Feministin Cânân Arın. Die Juristin hat 2007 die Plattform für die Durchsetzung von Frauenrechten bei der Istanbuler Anwaltskammer gegründet. Frauen erhalten dort kostenlos Rechtsberatung, bei Bedarf auch Rechtsbeistand. »Die Medien sind mehr oder weniger ganz in Regierungshand.« Sezgin Tanrıkulu, Abgeordneter der Republikanischen Volkspartei (CHP) Am 20. März 2021 ist die [Gruppe1] auf Beschluss von Präsident Recep Tayyip Erdoğan aus dem 2011 beschlossenen und 2014 in Kraft getretenen Übereinkommen des Europarats zur Bekämpfung und Verhütung von Gewalt gegen Frauen und häuslicher Gewalt (Istanbul-Konvention) ausgetreten. Für den 1. Juli 2021, als der Austritt rechtskräftig wurde, hatten Frauengruppen eine Demonstration dagegen in der Küstenstadt İzmir organisiert. Die Polizei setzte Pfeffergas und Knüppel ein, 17 Frauen wurden wegen Beleidigung des Präsidenten und Verstoßes gegen das Versammlungs- und Demonstrations­ge­setz festgenommen und gegen Meldeauf­lagen wieder auf freien Fuß gesetzt. Im August 2021 akzeptierte ein Istanbuler Gericht die Anklageschrift, die für jede der Frauen eine Haftstrafe bis zu acht Jahren forderte. Arın sagt dazu: »Wenn Staatsdiener schon grundlos Gewalt gegen Demonstrantinnen ausüben, warum sollen sich Männer dann zu Hause zurückhalten?« Anıt Sayaç ist eine Plattform gegen Frauenmorde. Sie registrierte in der [Gruppe1] 2021 insgesamt 420 Femizide. Amnesty International beruft sich auf Angaben unabhängiger Frauenrechts­organisationen und nennt 280 Frauen, die 2021 an den Folgen geschlechtsspezifischer Gewalt starben, in 217 weiteren Fällen seien verdächtige Todesumstände festgestellt worden. Asiye Atalay wird auf der Liste von Anıt Sayaç als 135. Opfer in diesem Jahr in der [Gruppe1] gezählt. Menschenrechtlerinnen und -rechtler beobachten ein politisch gewolltes Missverhältnis zwischen der Milde in der Verfolgung von Kapitalverbrechen und der Strenge bei der Ahndung politischer Delikte. Am 25. April wurden die acht Angeklagten im sogenannten Gezi-Prozess zu langen Haftstrafen verurteilt: Can Atalay, Çiğdem Mater, Hakan Altınay, Mine Özerden, Mücella Yapıcı und Tayfun Kahraman zu 18 Jahren Gefängnis und der Unternehmer und Kulturmäzen Osman Kavala, der seit über viereinhalb Jahren im Gefängnis sitzt, zu einer verschärften lebenslangen Freiheitsstrafe. Die sogenannten Gezi-Proteste richteten sich 2013 zunächst gegen den geplanten Bau eines Einkaufszentrum im Istanbuler Gezi-Park und weiteten sich später zu landesweiten Protesten für Demokratie und Menschenrechte aus. »Politische Gefangene sitzen jahrelang in Untersuchungshaft, das sind Haftstrafen ohne Gerichtsurteil«, sagt Sezgin Tanrıkulu, ein Abgeordneter der oppositionellen Republikanischen Volkspartei (CHP), der selbst Jurist ist. »In der ersten Anklageschrift wurde Kavala wegen der Protestaktionen anderer, wie einem Klavierkonzert im Gezi-Park, beschuldigt, Drahtzieher der Ausschreitungen zu sein. Zum Schluss ging es dann nur noch um Gasmasken, die an seinem Ausstellungsort verteilt wurden, und ähnliche Bagatellen. Das ist Willkürjustiz.« Die Architektin Mücella Yapıcı ist 72 Jahre alt. Bei ihrer Verurteilung sagte sie: »Ich habe keinen Diebstahl begangen, mich keiner Korruption schuldig gemacht. Mein Leben lang war ich ehrlich. (…) Wir sind stolz darauf, Gezi erhobenen Hauptes zu verteidigen.« Die Regierung Erdoğan habe den Stand der Menschenrechte in der [Gruppe1] um Jahrzehnte zurückgeworfen und verstoße offenkundig gegen internationale Menschenrechtsnormen, stellte die Menschenrechtsorganisation Human Rights Watch (HRW) im Januar in ihrem Bericht zur weltweiten Menschenrechtslage fest. In der [Gruppe1] herrschten restriktive Bedingungen für Medien, Menschenrechtler, LGBT, kur­dische politische Aktivisten und andere als regierungskritisch ausgemachte Personen, resümiert der HRW-Bericht. Ehemals führende Politikerinnen und Politiker der oppositionellen ­Demokratischen Volkspartei (HDP) wurden für fünf Jahre inhaftiert und vor dem Verfassungsgericht ist ein Verbotsverfahren gegen die Partei anhängig. Die politische Kontrolle über die [Gruppe1] Gerichte höhle rechtsstaatliche Prinzipien aus, so HRW. Straffreiheit für polizeiliche Übergriffe und gewalt­sames Verschwindenlassen sei nach wie vor weitverbreitet. Im Januar veröffentlichte der CHP-Abgeordnete Tanrıkulu seinen jährlichen Bericht über Rechtsverletzungen in der [Gruppe1]. Demnach wurden im vergangenen Jahr 3 145 Menschen gefoltert und misshandelt. 250 Journalistinnen und Journalisten wurden in mindestens 130 Verfahren wegen ihrer Berichterstattung vor Gericht gestellt, mindestens 50 Personen wurden wegen ihrer journalistischen Aktivitäten inhaftiert, 26 Journalisten und Moderatoren aufgrund oder während ihrer Berichterstattung tätlich angegriffen. Zudem heißt es in dem Bericht, 64 Websites seien geschlossen und der Zugang zu 1 460 Nachrichten sei gesperrt worden. »Die Medien sind mehr oder weniger ganz in Regierungshand«, unterstreicht Tanrıkulu im Gespräch mit der Jungle World. »Die Justiz dient als Repressionsorgan und bestraft immer wieder zur Abschreckung Unschuldige.« 2007 wurde Hrant Dink, Herausgeber der armenisch-[Gruppe1] Zeitung Agos, auf offener Straße erschossen. »Der wurde noch posthum für Straftaten verurteilt, die er niemals begangene hatte«, so Tanrıkulu. Dink wurde verurteilt, weil er das [Gruppe1] beleidigt und behauptet haben soll, die [Gruppe1] hätten vergiftetes Blut. Dabei hatte er in einem Leitartikel an die Armenier appelliert, sich von ihrem [Gruppe1] zu befreien, der ihr Blut vergifte. Garo Paylan ist Abgeordneter der HDP. Auch gegen ihn wurden schon Beleidigungsklagen angestrebt, allerdings erfolglos. Am 23. April reichte er im Parlament einen Gesetzentwurf ein, der die Anerkennung des Genozids an den Armeniern zum Thema hat. In sozialen Medien brach ein Shitstorm aus, nachdem die Vorsitzende der oppositionellen, aber nationalistischen İyi Parti (Gute Partei), Meral Akşener, die Aufhebung seiner Immunität gefordert hatte. Er verdrehe die Geschichte und beleidige Volk und Nation, so Akşener. Paylan erwiderte: »Meral Akşener hat mich den Wölfen zum Fraß vorgeworfen«, womit er die Krimina­lisierung von Oppositionellen treffend beschrieb, die sich immer mehr im Land etabliert.;0;0;0;0;0;0;0;0;0;0
30;6352df37b912504bf4008120;Ministerpräsidentin Manuela Schwesig (SPD) betonte, es stehe der schwerwiegende Verdacht im Raum, dass es vielleicht Brandstiftung sein könnte, die sich gegen die [Gruppe1] gerichtet habe. Deshalb müsse das schnell aufgeklärt werden. Aus Innenministerium hieß es, die Polizei solle verstärkt an [Gruppe1]unterkünften Streife fahren.;0;0;0;0;0;0;0;0;0;0
